name,type,district,phone,address
"СПб ГБОУ СПО ""Медицинский колледж №1""",Образовательные учреждения,Кировский район,"Тел. 786-01-44, 747-10-19, 786-09-70","198188, Санкт-Петербург, ул. Зайцева, д. 28"
"СПб ГБОУ СПО ""Медицинский колледж №2""",Образовательные учреждения,Красносельский район,"Тел. 409-70-10, 409-70-20","198205, Санкт-Петербург, ул. Чекистов, д. 18"
"СПб ГБОУ СПО ""Медицинский колледж №3""",Образовательные учреждения,Выборгский район,Тел. 510-67-44,"194354, Санкт-Петербург, пер. Учебный,  д. 9"
"СПб ГБПОУ ""Акушерский колледж""",Образовательные учреждения,Калининский район,Тел. 246-22-50; 246-22-58 (приемная комиссия),"195269, Санкт-Петербург, ул. Учительская, д. 9, корп. 3"
"СПб ГБОУ СПО ""Медицинский колледж им. В.М. Бехтерева""",Образовательные учреждения,Кировский район,"Тел. 246-24-43, 246-24-49, 8-911-297-98-25","196247, Санкт-Петербург, пр. Ленинский, д. 149"
"СПб ГБУЗ ""Детская городская поликлиника №68"" (Детское поликлиническое отделение №69)",Поликлиники детские,Красногвардейский район,Тел. 520-63-43,"195030, Санкт-Петербург, ул. Коммуны, д. 32, корп. 1"
"СПб ГБУЗ ""Детская городская поликлиника №68"" (Детское поликлиническое отделение №66)",Поликлиники детские,Красногвардейский район,Тел.  529-84-66,"195426, Санкт-Петербург, ул. Передовиков, д. 21"
"СПб ГБУЗ ""Детская городская поликлиника №68"" (Детское поликлиническое отделение №68)",Поликлиники детские,Красногвардейский район,Тел. 524-18-46,"195246, Санкт-Петербург, пр. Наставников, д. 20, корп. 1"
Женская консультация №8,Женские консультации,Красногвардейский район,Тел. 529-84-50,"195279, Санкт-Петербург, ул. Передовиков, д.21"
"СПб ГБУЗ ""Детская городская поликлиника №68"" (Детское поликлиническое отделение №34)",Поликлиники детские,Красногвардейский район,Тел. 528-33-35,"195112, Санкт-Петербург, пр. Шаумяна, д. 29"
"СПб ГБУЗ ""Детская городская поликлиника №73"" (Детское поликлиническое отделение №6)",Поликлиники детские,Невский район,Тел. 362-43-76,"193174, Санкт-Петербург, ул. Лесозаводская, д. 6"
СПб ГБУЗ «ГП №106» Офис врача общей практики №1,Поликлиники взрослые,Красносельский район,Тел. 751-98-48,"ул. Десантников, д.20/3"
"СПб ГБУЗ ""Городская поликлиника № 60 Пушкинского района""",Поликлиники взрослые,Пушкинский район,Тел. 246-08-01,"196607, Санкт-Петербург, г. Пушкин, ул. Московская, д. 15"
"СПб ГКУЗ ""Детский городской сурдологический центр""",Больницы детские,Выборгский район,Тел. 246-47-07,"194356, Санкт-Петербург, ул. Есенина, д.26, корп.4"
"СПБ ГБУ ДПО ""Центр последипломного образования специалистов медицинского профиля""",Образовательные учреждения,Центральный район,"Тел. 273-32-18, 272-21-21, 456-04-52","191028, Санкт-Петербург, ул.Кирочная, д.16"
"СПБ ГБПОУ ""Фельдшерский колледж""",Образовательные учреждения,Калининский район,"Тел. 531-16-22, 594-79-05","195267, город Санкт-Петербург, улица Ушинского, дом 45"
"СПб ГБУЗ ""Городская больница №14""",Больницы взрослые,Кировский район,"Тел. 786-76-76, 786-77-77, Отдел платных услуг: +7 (960) 259-17-19 (в будни с 9.00 до 16.30)","198099, Санкт-Петербург, ул. Косинова, д. 19/9"
СПб ГБУЗ «ГП №106» Офис врача общей практики №2,Поликлиники взрослые,Красносельский район,Тел. 698-72-49,"пр.Героев, д.26/3"
СПБ ГБУЗ “Николаевская больница” Поликлиническое отделение,Больницы взрослые,Петродворцовый район,Тел. 450-70-88,"198510, Санкт-Петербург, г. Петергоф , ул. Царицинская, д 1 "
СПБ ГБУЗ “Николаевская больница” (поликлиническое отделение-филиал),Больницы взрослые,Петродворцовый район,Тел. 428-00-55,"198504, Санкт-Петербург, ст. Петергоф, ул. Ботаническая, д.3, кор. 2 "
СПБ ГБУЗ “Николаевская больница” (женская консультация),Больницы взрослые,Петродворцовый район,Тел. 428-82-43,"198504, Санкт-Петербург, ст. Петергоф, ул. Шахматова, д. 12, корп. 4 . "
"СПб ГБУЗ ""Николаевская больница""  (кожно-венерологическое отделение)",Больницы взрослые,Петродворцовый район,Тел. 428-76-17,"198504, Санкт-Петербург, ст. Петергоф, ул. Чебышевская, д. 12, кор. 3"
"СПб ГБУЗ ""Николаевская больница""  (психоневрологическое отделение)",Больницы взрослые,Петродворцовый район,Тел. 428-56-24,"198504, Санкт-Петербург, ст. Петергоф, Ботаническая, д. 3, кор. 2 "
"СПб ГБУЗ ""Николаевская больница (противотуберкулезное отделение) ",Больницы взрослые,Петродворцовый район,Тел. 450-62-08,"198510, Санкт-Петербург, г. Петергоф, ул. Самсоньевская, д. 3"
"СПб ГБУЗ ""Детская городская поликлиника №67 (филиал)",Поликлиники детские,Петродворцовый район,Тел. 428-85-21,"Санкт-Петербург, ст. Петергоф, ул. Шахматова, 12/1"
"СПб ГБУЗ ""Станция скорой медицинской помощи Петродворцового района"" (подстанция)",Медицинские центры,Петродворцовый район,Тел. 422-92-86,"198412, Санкт-Петербург, г. Ломоносов, ул. Красного флота, д. 13"
"СПб ГБУЗ ""Противотуберкулезный диспансер №5""",Диспансеры,Калининский район,"Тел. 409-74-30, 409-74-40","195067, г. Санкт-Петербург, ул. Бестужевская, д. 48"
